{
 "schema_version": "1.0",
 "page_id": "p01",
 "raster": {
  "asset_path": "p01_latin/p01_latin.png",
  "file_sha256": "3c1e981bb9dfd5030fbc25022238adbe5d6b899c429db221359793fe5a0f6133",
  "pixel_sha256": "d5a30ae31068f2eaf3cfbbd65cca47fabbc7b36c399cf76d974ab704de5d96fd",
  "width_px": 520,
  "height_px": 340,
  "canonical_format": "rgb8",
  "colour_tag": "srgb",
  "icc_sha256": null,
  "orientation_policy": "applied_once",
  "decoder_id": "m0-fixture-pillow-rasterizer",
  "dpi_x": 300.0,
  "dpi_y": 300.0
 },
 "page": {
  "width_pt": 124.8,
  "height_pt": 81.6,
  "raster_to_page_pt": [
   0.24,
   0.0,
   0.0,
   -0.24,
   0.0,
   81.6
  ]
 },
 "producer": {
  "name": "m0-fixture-generator",
  "version": "1.0",
  "models": [],
  "languages": []
 },
 "granularity": "symbol",
 "reading_order_status": "supplied",
 "reading_order": [
  "g000",
  "g001",
  "g002",
  "g003"
 ],
 "spans": [
  {
   "id": "g000",
   "text": "8",
   "separator_after": " ",
   "polygon": [
    [
     20,
     58
    ],
    [
     159,
     58
    ],
    [
     159,
     209
    ],
    [
     20,
     209
    ]
   ],
   "direction": "ltr",
   "role": "body",
   "language": null,
   "confidence": {
    "value": 99.0,
    "scale": "range_0_100",
    "calibrated": false
   },
   "provenance": "source_generated",
   "symbols": [
    {
     "id": "g000s00",
     "text_range_utf8": [
      0,
      1
     ],
     "polygon": [
      [
       20,
       58
      ],
      [
       159,
       58
      ],
      [
       159,
       209
      ],
      [
       20,
       209
      ]
     ],
     "confidence": {
      "value": 99.0,
      "scale": "range_0_100",
      "calibrated": false
     }
    }
   ]
  },
  {
   "id": "g001",
   "text": "6",
   "separator_after": " ",
   "polygon": [
    [
     180,
     58
    ],
    [
     319,
     58
    ],
    [
     319,
     209
    ],
    [
     180,
     209
    ]
   ],
   "direction": "ltr",
   "role": "body",
   "language": null,
   "confidence": {
    "value": 99.0,
    "scale": "range_0_100",
    "calibrated": false
   },
   "provenance": "source_generated",
   "symbols": [
    {
     "id": "g001s00",
     "text_range_utf8": [
      0,
      1
     ],
     "polygon": [
      [
       180,
       58
      ],
      [
       319,
       58
      ],
      [
       319,
       209
      ],
      [
       180,
       209
      ]
     ],
     "confidence": {
      "value": 99.0,
      "scale": "range_0_100",
      "calibrated": false
     }
    }
   ]
  },
  {
   "id": "g002",
   "text": "8",
   "separator_after": " ",
   "polygon": [
    [
     340,
     58
    ],
    [
     479,
     58
    ],
    [
     479,
     209
    ],
    [
     340,
     209
    ]
   ],
   "direction": "ltr",
   "role": "body",
   "language": null,
   "confidence": {
    "value": 99.0,
    "scale": "range_0_100",
    "calibrated": false
   },
   "provenance": "source_generated",
   "symbols": [
    {
     "id": "g002s00",
     "text_range_utf8": [
      0,
      1
     ],
     "polygon": [
      [
       340,
       58
      ],
      [
       479,
       58
      ],
      [
       479,
       209
      ],
      [
       340,
       209
      ]
     ],
     "confidence": {
      "value": 99.0,
      "scale": "range_0_100",
      "calibrated": false
     }
    }
   ]
  },
  {
   "id": "g003",
   "text": "a",
   "separator_after": " ",
   "polygon": [
    [
     20,
     214
    ],
    [
     101,
     214
    ],
    [
     101,
     284
    ],
    [
     20,
     284
    ]
   ],
   "direction": "ltr",
   "role": "body",
   "language": null,
   "confidence": {
    "value": 99.0,
    "scale": "range_0_100",
    "calibrated": false
   },
   "provenance": "source_generated",
   "symbols": [
    {
     "id": "g003s00",
     "text_range_utf8": [
      0,
      1
     ],
     "polygon": [
      [
       20,
       214
      ],
      [
       101,
       214
      ],
      [
       101,
       284
      ],
      [
       20,
       284
      ]
     ],
     "confidence": {
      "value": 99.0,
      "scale": "range_0_100",
      "calibrated": false
     }
    }
   ]
  }
 ],
 "protected_regions": []
}